{
  "schemaVersion": "0.1-internal",
  "envelopeType": "finish-run-envelope",
  "operation": "finish-run",
  "methodOutcome": "completed",
  "evidencePath": ".paneforge-method/v0.1/tasks/team%3Atask-001/runs/run-controller-fixture/evidence/evidence-controller.json",
  "evidenceSha256": "EEEEEEEEEEEEEEEEEEEEEEEEEEEEEEEEEEEEEEEEEEEEEEEEEEEEEEEEEEEEEEEE",
  "runPath": ".paneforge-method/v0.1/tasks/team%3Atask-001/runs/run-controller-fixture/run.json",
  "runSha256": "FFFFFFFFFFFFFFFFFFFFFFFFFFFFFFFFFFFFFFFFFFFFFFFFFFFFFFFFFFFFFFFF",
  "taskBindingLookup": {
    "operation": "find_task_binding_by_session",
    "sessionId": "session-controller-fixture",
    "fallback": "manual-review"
  },
  "taskBindingPatch": {
    "status": "completed",
    "progress": 100,
    "completionSummary": "Controller fixture completed with aligned evidence.",
    "exitCode": 0,
    "metadata": {
      "methodLayer": {
        "protocolVersion": "0.1",
        "taskId": "team:task-001",
        "runId": "run-controller-fixture",
        "artifactRoot": ".paneforge-method/v0.1",
        "taskPath": ".paneforge-method/v0.1/tasks/team%3Atask-001/task.json",
        "runPath": ".paneforge-method/v0.1/tasks/team%3Atask-001/runs/run-controller-fixture/run.json",
        "latestEvidencePath": ".paneforge-method/v0.1/tasks/team%3Atask-001/runs/run-controller-fixture/evidence/evidence-controller.json"
      }
    }
  },
  "leaderReport": {
    "workerId": "paneforge-binding-controller",
    "status": "completed",
    "summary": "Controller fixture completed with aligned evidence.",
    "dispatchPolicy": "if-not-auto-notified"
  }
}
